{
    "@context": "https://schema.org",
    "@type": "Event",
    "identifier": 11713,
    "sameAs": "www.sport.be",
    "name": "bbb",
    "keywords": [
        {
            "@type": "DefinedTerm",
            "name": "SPORTS",
            "termCode": "CAT15-00",
            "inDefinedTermSet": "https://tinyurl.com/sesam-categories"
        }
    ],
    "location": {
        "@type": [
            "Place",
            "DefinedTerm"
        ],
        "name": "Mons",
        "termCode": "LOC12",
        "inDefinedTermSet": "https://tinyurl.com/sesam-areas"
    },
    "audience": [
        {
            "@type": [
                "Audience",
                "DefinedTerm"
            ],
            "name": "Amis",
            "termCode": "AUD01",
            "inDefinedTermSet": "https://tinyurl.com/sesam-audiences"
        },
        {
            "@type": [
                "Audience",
                "DefinedTerm"
            ],
            "name": "Conjoint",
            "termCode": "AUD02",
            "inDefinedTermSet": "https://tinyurl.com/sesam-categories"
        }
    ],
    "organizer": {
        "@type": "Organization",
        "identifier": 1001,
        "name": "ccc"
    },
    "startDate": "2024-01-04",
    "description": "du sport"
}